{"collection_id":"meme","entries":[{"content":"用于调侃当前情况显得神秘、反常或存在不确定性。典型用法：今晚月亮不太对劲，做决定还是谨慎一点。","summary":"用月亮异常来表达当前情况神秘、反常或需要谨慎。","tags":["type:reference","risk:low"],"terms":{"alias":[],"recognition":["今晚月亮不太对劲"]},"title":"月相警报"},{"content":"把临时、简陋但仍承担指挥职责的人或方案称为纸箱舰长。典型用法：今天由纸箱舰长指挥，设备虽然简陋但流程不能乱。","summary":"调侃条件简陋却仍要承担组织或指挥职责。","tags":["type:metaphor","risk:low"],"terms":{"alias":["箱长"],"recognition":["今天由纸箱舰长指挥"]},"title":"纸箱舰长"},{"content":"表示切换到一个谨慎、保守、先检查再行动的备用方案。典型用法：情况不稳定，先启动蓝莓协议。","summary":"指启动谨慎检查、降低风险的备用方案。","tags":["type:reference","risk:low"],"terms":{"alias":["蓝莓预案"],"recognition":["启动蓝莓协议"]},"title":"蓝莓协议"},{"content":"形容条件越困难反而越坚持把事情完成，通常带有夸张和自我鼓励。典型用法：风越大信送得越快，今天也得把任务交付。","summary":"用夸张方式表达越困难越要坚持完成任务。","tags":["type:metaphor","risk:low"],"terms":{"alias":[],"recognition":["风越大信送得越快"]},"title":"逆风邮差"},{"content":"形容某个计划只能在特定时间短暂维持动力，带有轻松自嘲意味。典型用法：今天的电量是周三限定，过了下午就得充电。","summary":"自嘲精力或动力只在某段时间短暂有效。","tags":["type:self-mockery","risk:low"],"terms":{"alias":["周三限定电量"],"recognition":["今天的电量是周三限定"]},"title":"周三电池"}],"pack_id":"manual-test","schema_version":1,"source":{"homepage":"https://github.com/Himifox/N.E.K.O-PluginMarket","license":"CC0-1.0","name":"N.E.K.O Manual Knowledge Test"}}